{
  "schema_version": "dehps-m4-information-theory-preregistration.v1",
  "contract_version": "m4-information-theory-contract-v1",
  "version": "1.0.0",
  "status": "FROZEN",
  "artifact_digest": "a4f29c1392305b6ef2dc90134901c74f8ffb297071838d734d1e17e8439ad6e8",
  "created_at": "2026-07-24T14:30:00+08:00",
  "code_commit": "80116b488f461ed214b46b9e2668bb190a435d0c",
  "working_tree_clean": true,
  "supersedes_digest": null,
  "research_questions": [
    "RQ1_PRIOR_STATE_REDUCES_NEXT_DRAW_UNCERTAINTY",
    "RQ2_STRICT_OOS_INFORMATION_GAIN_EXCEEDS_PRACTICAL_NULL",
    "RQ3_REAL_RELATION_OUTPERFORMS_NEGATIVE_CONTROLS",
    "RQ4_SIGNAL_MAGNITUDE_EXCLUDABLE_AT_CURRENT_POWER",
    "RQ5_EXISTING_FULL_SCORE_CONTAINS_PROBABILITY_OR_RANKING_INFORMATION"
  ],
  "targets": {
    "contract_version": "m4-information-theory-target-contract-v1",
    "contract_digest": "c768d4cc34ca92ce705cc9bc796798e459e85ccc4bc32c2e44622691c5068b2a",
    "primary": {
      "target_id": "RED_NUMBER_MARGINAL_EVENT",
      "unit": "issue_red_number_binary_event",
      "value_space": [0, 1],
      "event_count_per_issue": 33,
      "positive_count_per_issue": 6,
      "negative_count_per_issue": 27,
      "cluster_key": "issue",
      "resampling_unit": "issue",
      "independence_assumption": "events_within_issue_are_dependent",
      "decision_role": "primary"
    },
    "pair": {
      "target_id": "RED_NUMBER_PAIR_EVENT",
      "role": "secondary_exploratory_with_multiplicity_control",
      "pair_count": 528,
      "pair_set": "all_unordered_pairs_from_1_to_33",
      "minimum_support_issues": 20,
      "multiplicity_family": "PAIR_FAMILY",
      "post_result_selection": "forbidden",
      "top_level_decision_eligible": false
    },
    "structural": [
      {
        "target_id": "odd_count",
        "data_type": "integer",
        "state_space": [0, 1, 2, 3, 4, 5, 6],
        "baseline": "exact_uniform_without_replacement",
        "scoring_rule": "categorical_log_loss",
        "decision_role": "secondary"
      },
      {
        "target_id": "low_count",
        "data_type": "integer",
        "definition": "red_number<=16",
        "state_space": [0, 1, 2, 3, 4, 5, 6],
        "baseline": "exact_uniform_without_replacement",
        "scoring_rule": "categorical_log_loss",
        "decision_role": "secondary"
      },
      {
        "target_id": "sum",
        "data_type": "integer",
        "state_space": {"minimum": 21, "maximum": 183},
        "baseline": "exact_combinatorial_distribution",
        "scoring_rule": "categorical_log_loss",
        "decision_role": "secondary"
      },
      {
        "target_id": "span",
        "data_type": "integer",
        "state_space": {"minimum": 5, "maximum": 32},
        "baseline": "exact_combinatorial_distribution",
        "scoring_rule": "categorical_log_loss",
        "decision_role": "secondary"
      },
      {
        "target_id": "consecutive_pair_count",
        "data_type": "integer",
        "state_space": [0, 1, 2, 3, 4, 5],
        "baseline": "exact_combinatorial_distribution",
        "scoring_rule": "categorical_log_loss",
        "decision_role": "secondary"
      },
      {
        "target_id": "zone_1_count",
        "data_type": "integer",
        "definition": "red_number_in_1_to_11",
        "state_space": [0, 1, 2, 3, 4, 5, 6],
        "baseline": "multivariate_hypergeometric",
        "scoring_rule": "categorical_log_loss",
        "decision_role": "secondary"
      },
      {
        "target_id": "zone_2_count",
        "data_type": "integer",
        "definition": "red_number_in_12_to_22",
        "state_space": [0, 1, 2, 3, 4, 5, 6],
        "baseline": "multivariate_hypergeometric",
        "scoring_rule": "categorical_log_loss",
        "decision_role": "secondary"
      },
      {
        "target_id": "zone_3_count",
        "data_type": "integer",
        "definition": "red_number_in_23_to_33",
        "state_space": [0, 1, 2, 3, 4, 5, 6],
        "baseline": "multivariate_hypergeometric",
        "scoring_rule": "categorical_log_loss",
        "decision_role": "secondary"
      },
      {
        "target_id": "repeat_from_previous_issue_count",
        "data_type": "integer",
        "state_space": [0, 1, 2, 3, 4, 5, 6],
        "baseline": "hypergeometric_given_previous_six",
        "scoring_rule": "categorical_log_loss",
        "decision_role": "secondary"
      }
    ],
    "full_combination": {
      "legal_space": "choose_6_without_replacement_from_33",
      "combination_count": 1107568,
      "allowed_uses": [
        "joint_log_probability",
        "coding_length",
        "ranking_information",
        "information_upper_bound"
      ],
      "topk_primary_endpoint": false
    }
  },
  "null_models": {
    "primary": "F0_THEORETICAL_UNIFORM",
    "secondary": "F0_TRAINING_EMPIRICAL_BASE_RATE",
    "F0_THEORETICAL_UNIFORM": {
      "number_probability": 0.18181818181818182,
      "joint_combination_probability": 9.02885775817407e-07,
      "fit_scope": "none"
    },
    "F0_TRAINING_EMPIRICAL_BASE_RATE": {
      "fit_scope": "current_outer_training_history_only",
      "smoothing": "beta_binomial_jeffreys_alpha_0_5_beta_0_5",
      "role": "sensitivity_null"
    }
  },
  "feature_families": [
    {
      "family_id": "F0",
      "name": "Null Baseline",
      "variants": [
        "F0_THEORETICAL_UNIFORM",
        "F0_TRAINING_EMPIRICAL_BASE_RATE"
      ],
      "data_dependencies": ["legal_sample_space", "outer_training_history"],
      "missing_policy": "not_applicable"
    },
    {
      "family_id": "F1",
      "name": "Recent Frequency",
      "windows": [10, 20, 30, 50, 100],
      "selection_scope": "nested_inner_training_only",
      "data_dependencies": ["prior_red_draws"],
      "missing_policy": "family_unavailable_until_window_complete"
    },
    {
      "family_id": "F2",
      "name": "Gap and Interval",
      "features": [
        "periods_since_last_seen",
        "recent_gap_percentile",
        "expanding_historical_mean_gap",
        "expanding_historical_gap_variance"
      ],
      "recent_gap_windows": [20, 50, 100],
      "data_dependencies": ["prior_red_draws"],
      "missing_policy": "training_fold_median_with_missing_indicator"
    },
    {
      "family_id": "F3",
      "name": "Trend",
      "features": [
        "short_frequency_minus_long_frequency",
        "expanding_slope",
        "exponential_decay_summary"
      ],
      "short_long_window_pairs": [[10, 50], [20, 100], [30, 100]],
      "slope_windows": [20, 50, 100],
      "decay_half_lives": [5, 10, 20, 50],
      "selection_scope": "nested_inner_training_only",
      "data_dependencies": ["prior_red_draws"],
      "missing_policy": "family_unavailable_until_window_complete"
    },
    {
      "family_id": "F4",
      "name": "Historical Structure",
      "features": [
        "prior_sum",
        "prior_span",
        "prior_odd_count",
        "prior_low_count",
        "prior_zone_counts",
        "prior_consecutive_pair_count",
        "prior_repeat_count",
        "rolling_structure_mean",
        "rolling_structure_variance"
      ],
      "windows": [20, 50, 100],
      "data_dependencies": ["prior_red_draws"],
      "missing_policy": "training_fold_median_with_missing_indicator"
    },
    {
      "family_id": "F5",
      "name": "Existing Full Features",
      "source_module": "dehps.input_contracts.feature_contract",
      "contract_version": "feature.v1.0.0",
      "feature_count": 32,
      "feature_manifest_digest": "42ed7fc0a60a1be64f6f097f14e765f447f941d4427395a2e86bdbc99431c0c4",
      "feature_contract_digest": "c7b5d9572f93c17f4b84debd3f0e9f9d445b7e3c76c5bfe5d594d180064c9869",
      "normalization": "component_formulas_are_normative; any additional scaling is fit inside each outer training fold",
      "missing_policy": "reject_missing_dependency_and_nonfinite_value",
      "feature_names": [
        "structural_score",
        "frequency_score",
        "omission_score",
        "previous_consecutive_score",
        "previous_overlap_score",
        "previous_parity_shape_score",
        "dynamic_parity_transition_score",
        "previous_zone_shape_score",
        "recent_neighbor_score",
        "lagged_consecutive_score",
        "recent_gap_shape_score",
        "recent_sum_span_score",
        "qian_kun_pattern_score",
        "first_last_sum_score",
        "span_trend_score",
        "sum_trend_score",
        "ac_trend_score",
        "zone_ratio_score",
        "big_small_ratio_score",
        "parity_ratio_score",
        "prime_composite_score",
        "mod012_score",
        "tail_distribution_score",
        "sum_tail_score",
        "red_omission_shape_score",
        "sum_span_omission_score",
        "consecutive_trend_score",
        "repeat_trend_score",
        "stable_range_score",
        "weekday_trend_score",
        "short_hot_frequency_score",
        "long_omission_cooldown_score"
      ]
    },
    {
      "family_id": "F6",
      "name": "Matched Random Features",
      "dimension_match": "exact_feature_count_and_missingness_pattern",
      "marginal_match": "training_fold_empirical_quantile_transform",
      "temporal_match": "training_fold_stationary_bootstrap_with_primary_block_size_5",
      "correlation_match": "training_fold_covariance_factorization",
      "replicate_policy": "all_replicates_reported_as_distribution",
      "seed_policy_ref": "MATCHED_RANDOM_FEATURES"
    }
  ],
  "probe_models": {
    "allowed": [
      "EMPIRICAL_BASELINE",
      "REGULARIZED_LOGISTIC_REGRESSION",
      "NAIVE_BAYES",
      "SHALLOW_CALIBRATED_TREE"
    ],
    "primary": "REGULARIZED_LOGISTIC_REGRESSION",
    "inner_validation": {
      "method": "three_fold_expanding_blocked_time_series",
      "selection_metric": "issue_mean_log_loss",
      "all_preprocessing_nested": true,
      "tie_break": "lower_complexity_then_lexical_config_id"
    },
    "hyperparameters": {
      "REGULARIZED_LOGISTIC_REGRESSION": {